{
  "generated_at": "2026-10-04T11:00:00Z",
  "source_dir": "C:\\nexrender\\sources",
  "inbox_dir": "C:\\nexrender\\inbox",
  "items": [
    {
      "id": "video_test-a1b2c3d4",
      "video_path": "C:\\nexrender\\inbox\\video_test-a1b2c3d4.mp4",
      "source_name": "video_test.mp4",
      "metadata": {
        "width": 1920,
        "height": 1080,
        "fps": 30,
        "duration_sec": 12.5,
        "has_audio": false,
        "size_bytes": 48234496
      }
    }
  ]
}
